{"comparability":{"evaluator.commit_sha":"06f95fad117857fbeeab4b8a255ddee2dcbc41ee","evaluator.version":1,"execution.environment_contract_sha256":"sha256:2222222222222222222222222222222222222222222222222222222222222222","execution.kind":"protocol-replay","execution.model":"non-agent","execution.reasoning":"none","execution.time_budget_seconds":300,"execution.trial_id":"trial-one","fixture.content_sha256":"sha256:3333333333333333333333333333333333333333333333333333333333333333","fixture.id":"protocol-replay-v1","fixture.version":1,"initial_repository_sha":"4444444444444444444444444444444444444444","suite.content_sha256":"sha256:5555555555555555555555555555555555555555555555555555555555555555","suite.id":"protocol-evaluation-v1","suite.version":1,"trace.content_sha256":"sha256:e9e87509aaa29ee2b6f71e67571986b55d479fd4eed956660d2954892eda4193","trace.id":"protocol-replay-core","trace.version":1},"comparison_reference_run_id":"run-be30c7a68e8a732c789a28a3","flows":[{"events":[{"disposition":{"explanation":"The event matched and applied one transition.","label":"Accepted","raw":"accepted"},"error":{"explanation":null,"label":"Unknown","raw":null},"event":{"explanation":"A persisted research contract was submitted to the workflow.","label":"Research packet","raw":"RESEARCH_PACKET"},"sequence":0,"source_node":{"explanation":"Repository-grounded contract research state.","label":"Research","raw":"research"},"target_node":{"explanation":"Approved leaf delivery state.","label":"Implementation","raw":"implementation"},"transition":{"explanation":"Advance an approved research contract to implementation.","label":"Research approved","raw":"research-approved"}},{"disposition":{"explanation":"A matching transition failed its guard.","label":"Rejected","raw":"rejected"},"error":{"explanation":"A transition was found but its declared guard did not pass.","label":"Guard rejected","raw":"guard-rejected"},"event":{"explanation":"Implementation evidence was submitted for an exact pull request head.","label":"Implementation packet","raw":"IMPLEMENTATION_PACKET"},"sequence":1,"source_node":{"explanation":"Approved leaf delivery state.","label":"Implementation","raw":"implementation"},"target_node":{"explanation":null,"label":"Unknown","raw":null},"transition":{"explanation":null,"label":"Unknown","raw":null}},{"disposition":{"explanation":"The event matched and applied one transition.","label":"Accepted","raw":"accepted"},"error":{"explanation":null,"label":"Unknown","raw":null},"event":{"explanation":"The workflow entered its resumable blocked state.","label":"Flow blocked","raw":"FLOW_BLOCKED"},"sequence":2,"source_node":{"explanation":"Approved leaf delivery state.","label":"Implementation","raw":"implementation"},"target_node":{"explanation":"Resumable blocked workflow state.","label":"Blocked","raw":"blocked"},"transition":{"explanation":"Move an active delivery lane into the resumable blocked state.","label":"Lane blocked","raw":"lane-blocked"}},{"disposition":{"explanation":"The event matched and applied one transition.","label":"Accepted","raw":"accepted"},"error":{"explanation":null,"label":"Unknown","raw":null},"event":{"explanation":"The blocked workflow was authorized to resume at a supplied node.","label":"Resume authorized","raw":"RESUME_AUTHORIZED"},"sequence":3,"source_node":{"explanation":"Resumable blocked workflow state.","label":"Blocked","raw":"blocked"},"target_node":{"explanation":"Approved leaf delivery state.","label":"Implementation","raw":"implementation"},"transition":{"explanation":"Return a blocked flow to its authorized continuation state.","label":"Resume","raw":"resume"}},{"disposition":{"explanation":"No workflow transition supports the event.","label":"Unsupported","raw":"unsupported"},"error":{"explanation":"No transition supports the event from the current node.","label":"Unsupported event","raw":"unsupported-event"},"event":{"explanation":"The frozen trace intentionally supplied an event absent from the graph.","label":"Unknown trace event","raw":"UNKNOWN_EVENT"},"sequence":4,"source_node":{"explanation":"Approved leaf delivery state.","label":"Implementation","raw":"implementation"},"target_node":{"explanation":null,"label":"Unknown","raw":null},"transition":{"explanation":null,"label":"Unknown","raw":null}}],"run_id":"run-25461cb9e642f5f1573653ba"},{"events":[{"disposition":{"explanation":"The event matched and applied one transition.","label":"Accepted","raw":"accepted"},"error":{"explanation":null,"label":"Unknown","raw":null},"event":{"explanation":"A persisted research contract was submitted to the workflow.","label":"Research packet","raw":"RESEARCH_PACKET"},"sequence":0,"source_node":{"explanation":"Repository-grounded contract research state.","label":"Research","raw":"research"},"target_node":{"explanation":"Approved leaf delivery state.","label":"Implementation","raw":"implementation"},"transition":{"explanation":"Advance an approved research contract to implementation.","label":"Research approved","raw":"research-approved"}},{"disposition":{"explanation":"A matching transition failed its guard.","label":"Rejected","raw":"rejected"},"error":{"explanation":"A transition was found but its declared guard did not pass.","label":"Guard rejected","raw":"guard-rejected"},"event":{"explanation":"Implementation evidence was submitted for an exact pull request head.","label":"Implementation packet","raw":"IMPLEMENTATION_PACKET"},"sequence":1,"source_node":{"explanation":"Approved leaf delivery state.","label":"Implementation","raw":"implementation"},"target_node":{"explanation":null,"label":"Unknown","raw":null},"transition":{"explanation":null,"label":"Unknown","raw":null}},{"disposition":{"explanation":"The event matched and applied one transition.","label":"Accepted","raw":"accepted"},"error":{"explanation":null,"label":"Unknown","raw":null},"event":{"explanation":"The workflow entered its resumable blocked state.","label":"Flow blocked","raw":"FLOW_BLOCKED"},"sequence":2,"source_node":{"explanation":"Approved leaf delivery state.","label":"Implementation","raw":"implementation"},"target_node":{"explanation":"Resumable blocked workflow state.","label":"Blocked","raw":"blocked"},"transition":{"explanation":"Move an active delivery lane into the resumable blocked state.","label":"Lane blocked","raw":"lane-blocked"}},{"disposition":{"explanation":"The event matched and applied one transition.","label":"Accepted","raw":"accepted"},"error":{"explanation":null,"label":"Unknown","raw":null},"event":{"explanation":"The blocked workflow was authorized to resume at a supplied node.","label":"Resume authorized","raw":"RESUME_AUTHORIZED"},"sequence":3,"source_node":{"explanation":"Resumable blocked workflow state.","label":"Blocked","raw":"blocked"},"target_node":{"explanation":"Approved leaf delivery state.","label":"Implementation","raw":"implementation"},"transition":{"explanation":"Return a blocked flow to its authorized continuation state.","label":"Resume","raw":"resume"}},{"disposition":{"explanation":"No workflow transition supports the event.","label":"Unsupported","raw":"unsupported"},"error":{"explanation":"No transition supports the event from the current node.","label":"Unsupported event","raw":"unsupported-event"},"event":{"explanation":"The frozen trace intentionally supplied an event absent from the graph.","label":"Unknown trace event","raw":"UNKNOWN_EVENT"},"sequence":4,"source_node":{"explanation":"Approved leaf delivery state.","label":"Implementation","raw":"implementation"},"target_node":{"explanation":null,"label":"Unknown","raw":null},"transition":{"explanation":null,"label":"Unknown","raw":null}}],"run_id":"run-be30c7a68e8a732c789a28a3"},{"events":[{"disposition":{"explanation":"The event matched and applied one transition.","label":"Accepted","raw":"accepted"},"error":{"explanation":null,"label":"Unknown","raw":null},"event":{"explanation":"A persisted research contract was submitted to the workflow.","label":"Research packet","raw":"RESEARCH_PACKET"},"sequence":0,"source_node":{"explanation":"Repository-grounded contract research state.","label":"Research","raw":"research"},"target_node":{"explanation":"Approved leaf delivery state.","label":"Implementation","raw":"implementation"},"transition":{"explanation":"Advance an approved research contract to implementation.","label":"Research approved","raw":"research-approved"}},{"disposition":{"explanation":"A matching transition failed its guard.","label":"Rejected","raw":"rejected"},"error":{"explanation":"A transition was found but its declared guard did not pass.","label":"Guard rejected","raw":"guard-rejected"},"event":{"explanation":"Implementation evidence was submitted for an exact pull request head.","label":"Implementation packet","raw":"IMPLEMENTATION_PACKET"},"sequence":1,"source_node":{"explanation":"Approved leaf delivery state.","label":"Implementation","raw":"implementation"},"target_node":{"explanation":null,"label":"Unknown","raw":null},"transition":{"explanation":null,"label":"Unknown","raw":null}},{"disposition":{"explanation":"The event matched and applied one transition.","label":"Accepted","raw":"accepted"},"error":{"explanation":null,"label":"Unknown","raw":null},"event":{"explanation":"The workflow entered its resumable blocked state.","label":"Flow blocked","raw":"FLOW_BLOCKED"},"sequence":2,"source_node":{"explanation":"Approved leaf delivery state.","label":"Implementation","raw":"implementation"},"target_node":{"explanation":"Resumable blocked workflow state.","label":"Blocked","raw":"blocked"},"transition":{"explanation":"Move an active delivery lane into the resumable blocked state.","label":"Lane blocked","raw":"lane-blocked"}},{"disposition":{"explanation":"The event matched and applied one transition.","label":"Accepted","raw":"accepted"},"error":{"explanation":null,"label":"Unknown","raw":null},"event":{"explanation":"The blocked workflow was authorized to resume at a supplied node.","label":"Resum